{
  "state": "texas",
  "version": "2.0.0",
  "extractedFrom": "questionnaire-api/states/texas.js",
  "extractedAt": "2026-10-01T21:01:44.438Z",
  "entryNodeId": "0-0",
  "nodes": {
    "0-0": {
      "group": 0,
      "variant": 0,
      "question": "What best describes this Texas case?",
      "help": "<h5><u>Types of Texas Cases</u></h5><p>Some of the reasons you would answer that you were arrested without being convicted are the following situations:</p><ol><li>Your charges were dismissed, sometimes called \"nolle prosequi\";</li><li>You were acquitted, or deemed \"not guilty\" of a crime; or</li><li>You were never formally charged with a crime after your arrest; or</li><li>The grand jury returned a \"no bill,\" and you were not indicted of a crime</li></ol><p>There are several types of Alternative Sentencing in Texas, but the most common types are the following:</p><p><b>\"Deferred Adjudication\"</b> is a form of probation granted by the court where if you abide by the terms of your probation, the court will dismiss the charges against you. To get deferred adjudication you plead guilty or no contest at the start. If you violate the terms, you are entitled to a hearing, and the judge can find you guilty on that plea and sentence you.</p><p><b>\"Deferred Prosecution\"</b> or <b>\"Pre-Trial Diversion\"</b> is an informal type of probation, where if you complete the terms of your probation, the prosecutor will drop the charges against you before requiring you to enter a plea of guilt. It is less formal than Deferred Adjudication and typically agreed to with the prosecutor instead of a judge.</p>",
      "answers": [
        {
          "value": "I was arrested, but it didn't end up resulting in a conviction",
          "position": 0
        },
        {
          "value": "I was sentenced to Deferred Adjudication, Pretrial Diversion, or other Alternative Sentencing",
          "position": 1
        },
        {
          "value": "I was convicted as an adult",
          "position": 2
        },
        {
          "value": "I had a juvenile case (referred to juvenile probation or juvenile court, whether or not it was adjudicated)",
          "position": 3
        },
        {
          "value": "My case was federal",
          "position": 4
        }
      ],
      "questionsLeft": 18
    },
    "1-0": {
      "group": 1,
      "variant": 0,
      "question": "Which best describes the outcome of the criminal record we're currently evaluating?",
      "help": null,
      "answers": [
        {
          "value": "My charges were dismissed at some point after I was arrested",
          "position": 0
        },
        {
          "value": "I was acquitted, pardoned, or my conviction was overturned on appeal",
          "position": 1
        },
        {
          "value": "After being arrested, no charges were filed",
          "position": 2
        }
      ],
      "questionsLeft": 11
    },
    "2-0": {
      "group": 2,
      "variant": 0,
      "question": "<p>You've indicated that your charges were dismissed in the case we're evaluating.</p><p>Were you convicted of any other charges from the same arrest or set of events?</p>",
      "help": "<h5><u>The Same Criminal Episode</u></h5><div><b>If you were convicted of ANY of the offenses in the same \"Criminal Episode,\" answer YES to this question.</b></div><p>If the same case number was used, or the charges resulted from the same set of events or subject matter, they will typically be deemed to be part of the same Criminal Episode.</p><p>When you're arrested, it's frequently for more than one offense, even though some of those charges are dismissed or later dropped. In addition, it is not uncommon for prosecutors to file multiple charges as a tactic in negotiating plea bargains, eventually dismissing many of them.</p><div><b>Here is an example you may find helpful in understanding the concept:</b></div><p>If you were pulled over for driving while intoxicated, and the police found drugs in the car, these would be charges from the same arrest. If the drug charges were dismissed, but you were convicted of the driving while intoxicated charges, the answer to this question is YES. If both the driving while intoxicated charge and the drug charges were both dismissed, the answer to this question is NO.</p>",
      "answers": [
        {
          "value": "Yes, I was convicted of other charges from this incident",
          "position": 0
        },
        {
          "value": "No, I was not convicted of any other charges from this arrest or sequence of events",
          "position": 1
        }
      ],
      "questionsLeft": 10
    },
    "3-1": {
      "group": 3,
      "variant": 1,
      "question": "Which best describes the charges that were dismissed?",
      "help": null,
      "answers": [
        {
          "value": "A felony charge was dismissed",
          "position": 0
        },
        {
          "value": "A misdemeanor was dismissed",
          "position": 1
        }
      ],
      "questionsLeft": 9
    },
    "4-0": {
      "group": 4,
      "variant": 0,
      "question": "<p>Great! Now we need to figure out whether the Statute of Limitations have passed for the charges you had dismissed. </p><p>Please pay attention to the help button on the next question, unless you're sure you know the statute of limitations for the offense you were arrested for.</p>",
      "help": "<h5><u>What is a Statute of Limitations?</u></h5><p>A <b>\"Statute of Limitations\"</b> is the time allowed to file charges against you. The statute of limitations for some cases is as short as one year, while some serious criminal offenses have no limit and can be filed at any time, even decades after the crime occurred (an example would be murder). In Texas, most criminal offenses have statutes of limitation ranging from 2 to 10 years.</p><p>These time periods can vary quite a bit, so you often need to do a little research to find the right statute of limitation for your criminal offense. A good place to start here would be the Texas Code of Criminal Procedure Art. 12.01, et seq.</p>",
      "answers": [
        {
          "value": "Let's figure this out!",
          "position": 0
        }
      ],
      "questionsLeft": 8
    },
    "5-0": {
      "group": 5,
      "variant": 0,
      "question": "Has enough time passed for the Statute of Limitations to have expired for the offense you had dismissed? Please refer to the help button if you're not sure.",
      "help": "<h5><u>What is a Statute of Limitations?</u></h5>A <b>\"Statute of Limitations\"</b> is the time allowed to file charges against you. The statute of limitations for some cases is as short as one year, while some serious criminal offenses have no limit and can be filed at any time, even decades after the crime occurred (an example would be murder). In Texas, most criminal offenses have statutes of limitation ranging from 2 to 10 years.</p><p>These time periods can vary quite a bit, so you often need to do a little research to find the right statute of limitation for your criminal offense. A good place to start here would be the Texas Code of Criminal Procedure Art. 12.01, et seq. However, here are some general time periods that should be helpful in answering this question: </p><p><b>Felonies With NO Statute of Limitations:</b> Answer NO to this question if you were charged with any of the following crimes: Murder, Manslaughter, Sexual Assault, Human Trafficking, Compelling Prostitution of a Minor, Leaving the Scene of an Accident when a Death has Taken Place</p><p><b>Felonies With 10 Year Statutes of Limitations:</b> Answer NO to this question if it has not yet been 10 years since one of these criminal events occurred. Examples of these types of felonies would be: Compelling Prostitution, Arson, Crimes Involving Injury to the Elderly or Disabled, Forgery, and Theft offenses by government employees. </p><p><b>Felonies with 7 Year Statutes of Limitations:</b> Answer NO to this question if it has not yet been 7 years since one of these criminal events occurred. Examples of these types of felonies include: Identity Theft, Money Laundering, Fraud, Bigamy, and certain financial and tax crimes. </p><p><b>Felonies with 5 Year Statutes of Limitations:</b> Answer NO to this question of it has not yet been 5 years since one of these criminal events occurred. Examples of these types of felonies would be: Insurance Fraud, many Theft offenses, Robbery, Burglary, and Endangering or Abandoning a Child.</p><p><b>All Other Felonies Have a 3 Year Statute of Limitations:</b> Answer NO to this question if it has not yet been 3 years since one of these criminal events has occurred.</p><p><b>Most Misdemeanors have a 2 Year Statute of Limitation:</b> Answer NO to this question if it has not yet been 2 years since one of these criminal events has occurred.</p>",
      "answers": [
        {
          "value": "Yes, after reading the information in the help button I know it's been enough time",
          "position": 0
        },
        {
          "value": "No, I know that it has not been long enough",
          "position": 1
        },
        {
          "value": "I'm not sure, you better ask me more questions",
          "position": 2
        }
      ],
      "questionsLeft": 7
    },
    "6-1": {
      "group": 6,
      "variant": 1,
      "question": "Were your charges dismissed for \"Lack of Probable Cause\"? If you're not sure, please click the help button.",